,,,
2292,Clerks,[35],"Convenience and video store clerks Dante and Randal are sharp-witted, potty-mouthed and bored out of their minds. So in between needling customers, the counter jockeys play hockey on the roof, visit a funeral home and deal with their love lives."
2293,Mallrats,"[10749, 35]","Both dumped by their girlfriends, two best friends seek refuge in the local mall."
2255,Chasing Amy,"[35, 18, 10749]","Holden and Banky are comic book artists. Everything is going good for them until they meet Alyssa, also a comic book artist. Holden falls for her, but his hopes are crushed when he finds out she's a lesbian."
1832,Dogma,"[14, 35, 12]","The latest battle in the eternal war between Good and Evil has come to New Jersey in the late, late 20th Century. Angels, demons, apostles and prophets (of a sort) walk among the cynics and innocents of America and duke it out for the fate of humankind."
2294,Jay and Silent Bob Strike Back,[35],"When Jay and Silent Bob learn that their comic-book alter egos, Bluntman and Chronic, have been sold to Hollywood as part of a big-screen movie that leaves them out of any royalties, the pair travels to Tinseltown to sabotage the production."
2295,Clerks II,[35],"A calamity at Dante and Randall's shops sends them looking for new horizons - but they ultimately settle at Mooby's, a fictional Disney-McDonald's-style fast-food empire."
