,,,964,The Phantom of the Opera,"[18, 27]","A grotesquely disfigured composer known as ""The Phantom"" haunts Paris' opera house, where he's secretly grooming Christine Daae to be an opera diva. Luring her to his remote underground lair, The Phantom declares his love. But Christine loves Raoul de Chagny and plans to elope with him. When The Phantom learns this, he abducts Christine."
609,Poltergeist,[27],"Steve Freeling lives with his wife, Diane, and their three children, Dana, Robbie, and Carol Anne, in Southern California where he sells houses for the company that built the neighborhood. It starts with just a few odd occurrences, such as broken dishes and furniture moving around by itself. However, when he realizes that something truly evil haunts his home, Steve calls in a team of parapsychologists led by Dr. Lesh to help before it's too late."
138,Dracula,"[27, 18, 14]","British estate agent Renfield travels to Transylvania to meet with the mysterious Count Dracula, who is interested in leasing a castle in London and is, unbeknownst to Renfield, a vampire. After Dracula enslaves Renfield and drives him to insanity, the pair sail to London together, and as Dracula begins preying on London socialites, the two become the subject of study for a supernaturalist professor, Abraham Van Helsing."
16559,The Picture of Dorian Gray,"[18, 14, 53, 27]","Posing for a portrait, Dorian Gray talks with Lord Henry Wotton, who says that men should pursue their sensual longings, but laments that only the young get to do so. Taken with the idea, Dorian imagines a scenario in which the painting will age as he stays youthful. His wish comes true, and his boyish looks aid him as he indulges his every whim. But when a stunning revelation forces him to see what he's become, Dorian faces some very dangerous questions."
10785,The Thing From Another World,"[18, 27, 878]",Scientists and US Air Force officials fend off a blood-thirsty alien organism while investigating at a remote arctic outpost.
389,12 Angry Men,[18],"The defense and the prosecution have rested and the jury is filing into the jury room to decide if a young Spanish-American is guilty or innocent of murdering his father. What begins as an open and shut case soon becomes a mini-drama of each of the jurors' prejudices and preconceptions about the trial, the accused, and each other."
10911,The Guns of Navarone,"[10752, 28]","A team of allied saboteurs are assigned an impossible mission: infiltrate an impregnable Nazi-held island and destroy the two enormous long-range field guns that prevent the rescue of 2,000 trapped British soldiers."
551,The Poseidon Adventure,"[28, 12, 18, 53]","When their ocean liner capsizes, a group of passengers struggle to survive and escape."
197,Braveheart,"[28, 18, 36, 10752]","Enraged at the slaughter of Murron, his new bride and childhood love, Scottish warrior William Wallace slays a platoon of the local English lord's soldiers. This leads the village to revolt and, eventually, the entire country to rise up against English rule."
14412,Body Heat,"[80, 53, 10749]","In the midst of a searing Florida heat wave, a woman convinces her lover, a small-town lawyer, to murder her rich husband."
10331,Night of the Living Dead,"[27, 53]",A group of people try to survive an attack of bloodthirsty zombies while trapped in a rural Pennsylvania farmhouse.
988,The China Syndrome,"[18, 53]","While doing a series of reports on alternative energy sources, opportunistic reporter Kimberly Wells witnesses an accident at a nuclear power plant. Wells is determined to publicize the incident, but soon finds herself entangled in a sinister conspiracy to keep the full impact of the incident a secret."
600,Full Metal Jacket,"[18, 10752]",A pragmatic U.S. Marine observes the dehumanizing effects the U.S.-Vietnam War has on his fellow recruits from their brutal boot camp training to the bloody street fighting in Hue.
793,Blue Velvet,"[18, 80, 9648, 53]","The discovery of a severed human ear found in a field leads a young man on an investigation related to a beautiful, mysterious nightclub singer and a group of criminals who have kidnapped her child."
22596,Safety Last!,"[35, 10749, 28]","When a store clerk organizes a contest to climb the outside of a tall building, circumstances force him to make the perilous climb himself."
11368,Blood Simple,"[80, 18, 53]","The owner of a seedy small-town Texas bar discovers that one of his employees is having an affair with his wife. A chaotic chain of misunderstandings, lies and mischief ensues after he devises a plot to have them murdered."
1637,Speed,"[28, 12, 80]","Los Angeles SWAT cop Jack Traven is up against bomb expert Howard Payne, who's after major ransom money. First it's a rigged elevator in a very tall building. Then it's a rigged bus--if it slows, it will blow, bad enough any day, but a nightmare in LA traffic. And that's still not the end."
10907,The Adventures of Robin Hood,"[12, 28, 10749]",Robin Hood fights nobly for justice against the evil Sir Guy of Gisbourne while striving to win the hand of the beautiful Maid Marian.
