,,,
24,Kill Bill: Vol. 1,"[28, 80]","An assassin is shot by her ruthless employer, Bill, and other members of their assassination circle – but she lives to plot her vengeance."
393,Kill Bill: Vol. 2,"[28, 80, 53]","The Bride unwaveringly continues on her roaring rampage of revenge against the band of assassins who had tried to kill her and her unborn child. She visits each of her former associates one-by-one, checking off the victims on her Death List Five until there's nothing left to do … but kill Bill."
77338,Intouchables,"[18, 35]",A true story of two men who should never have met – a quadriplegic aristocrat who was injured in a paragliding accident and a young man from the projects.
598,Cidade de Deus,"[18, 80]","Buscapé was raised in a very violent environment. Despite the feeling that all odds were against him, he finds out that life can be seen with other eyes..."
45243,The Hangover Part II,[35],"The Hangover crew heads to Thailand for Stu's wedding. After the disaster of a bachelor party in Las Vegas last year, Stu is playing it safe with a mellow pre-wedding brunch. However, nothing goes as planned and Bangkok is the perfect setting for another adventure with the rowdy group."
18785,The Hangover,[35],"When three friends finally come to after a raucous night of bachelor-party revelry, they find a baby in the closet and a tiger in the bathroom. But they can't seem to locate their best friend, Doug – who's supposed to be tying the knot. Launching a frantic search for Doug, the trio perseveres through a nasty hangover to try to make it to the church on time."
527,Once Were Warriors,[18],"A drama about a Maori family living in Auckland, New Zealand. Lee Tamahori tells the story of Beth Heke’s strong will to keep her family together during times of unemployment and abuse from her violent and alcoholic husband."
19908,Zombieland,"[35, 27]","Columbus has made a habit of running from what scares him. Tallahassee doesn't have fears. If he did, he'd kick their ever-living ass. In a world overrun by zombies, these two are perfectly evolved survivors. But now, they're about to stare down the most terrifying prospect of all: each other."
47800,Brain Dead,"[9648, 27, 14]",A short experimental cutup film by Jon Moritsugu.
8216,Meet the Feebles,"[35, 10402]","Heidi, the star of the ""Meet The Feebles Variety Hour"" discovers her lover Bletch, The Walrus, is cheating on her. And with all the world waiting for the show, the assorted co-stars must contend with drug addiction, extortion, robbery, disease, drug dealing, and murder. Meanwhile the love between two of the stars is threatened by Trevor the Rat, who wishes to exploit the young starlet for use in his porno movie."
600,Full Metal Jacket,"[18, 10752]",A pragmatic U.S. Marine observes the dehumanizing effects the U.S.-Vietnam War has on his fellow recruits from their brutal boot camp training to the bloody street fighting in Hue.
979,Irréversible,"[18, 53, 80, 9648]","Events over the course of one traumatic night in Paris unfold in reverse-chronological order as the beautiful Alex is brutally raped and beaten by a stranger in the underpass. Her boyfriend and ex-lover take matters into their own hands and subsequently seek revenge upon the assailant. A simultaneously beautiful and terrible examination of the destructive nature of cause and effect, and how time destroys everything."
629,The Usual Suspects,"[18, 80, 53]","Held in an L.A. interrogation room, Verbal Kint attempts to convince the feds that a mythic crime lord, Keyser Soze, not only exists, but was also responsible for drawing him and his four partners into a multi-million dollar heist that ended with an explosion in San Pedro harbor – leaving few survivors. Verbal lures his interrogators with an incredible story of the crime lord's almost supernatural prowess."
613,Der Untergang,"[18, 36, 10752]","In April of 1945, Germany stands at the brink of defeat with the Russian Army closing in from the east and the Allied Expeditionary Force attacking from the west. In Berlin, capital of the Third Reich, Adolf Hitler proclaims that Germany will still achieve victory and orders his generals and advisers to fight to the last man. When the end finally does come, and Hitler lies dead by his own hand, what is left of his military must find a way to end the killing that is the Battle of Berlin, and lay down their arms in surrender."
762,Monty Python and the Holy Grail,"[12, 35, 14]","King Arthur, accompanied by his squire, recruits his Knights of the Round Table, including Sir Bedevere the Wise, Sir Lancelot the Brave, Sir Robin the Not-Quite-So-Brave-As-Sir-Lancelot and Sir Galahad the Pure. On the way, Arthur battles the Black Knight who, despite having had all his limbs chopped off, insists he can still fight. They reach Camelot, but Arthur decides not  to enter, as ""it is a silly place""."
70,Million Dollar Baby,[18],"Despondent over a painful estrangement from his daughter, trainer Frankie Dunn isn't prepared for boxer Maggie Fitzgerald to enter his life. But Maggie's determined to go pro and to convince Dunn and his cohort to help her."
817,Austin Powers: The Spy Who Shagged Me,"[12, 35, 80, 878]","When diabolical genius Dr. Evil travels back in time to steal superspy Austin Powers's ‘mojo,’ Austin must return to the swingin' '60s himself - with the help of American agent, Felicity Shagwell - to stop the dastardly plan. Once there, Austin faces off against Dr. Evil's army of minions to try to save the world in his own unbelievably groovy way."
818,Austin Powers in Goldmember,"[35, 80, 878]","The world's most shagadelic spy continues his fight against Dr. Evil. This time, the diabolical doctor and his clone, Mini-Me, team up with a new foe—'70s kingpin Goldmember. While pursuing the team of villains to stop them from world domination, Austin gets help from his dad and an old girlfriend."
816,Austin Powers: International Man of Mystery,"[878, 35, 80]","As a swingin' fashion photographer by day and a groovy British superagent by night, Austin Powers is the '60s' most shagadelic spy, baby! But can he stop megalomaniac Dr. Evil after the bald villain freezes himself and unthaws in the '90s? With the help of sexy sidekick Vanessa Kensington, he just might."
8872,Wayne's World,"[35, 10402]","The adventures of two amiably aimless metal-head friends, Wayne and Garth. From Wayne's basement, the pair broadcast a talk-show called ""Wayne's World"" on local public access television. The show comes to the attention of a sleazy network executive who wants to produce a big-budget version of ""Wayne's World""—and he also wants Wayne's girlfriend, a rock singer named Cassandra. Wayne and Garth have to battle the executive not only to save their show, but also Cassandra."
62,2001: A Space Odyssey,"[878, 9648, 12]","Humanity finds a mysterious object buried beneath the lunar surface and sets off to find its origins with the help of HAL 9000, the world's most advanced super computer."
3175,Barry Lyndon,"[18, 10749, 10752]","An Irish rogue uses his cunning and wit to work his way up the social classes of 18th century England, transforming himself from the humble Redmond Barry into the noble Barry Lyndon."
2196,Death at a Funeral,"[35, 18]","A myriad of outrageous calamities befall an eccentric English clan with more than a few skeletons in its closets, when its patriarch dies an unexpected death. Soon, every complication imaginable befall the grief-stricken mourners."
44264,True Grit,"[18, 12, 37]","Following the murder of her father by a hired hand, a 14-year-old farm girl sets out to capture the killer. To aid her, she hires the toughest U.S. Marshal she can find—a man with 'true grit'—Reuben J. 'Rooster' Cogburn."
824,Moulin Rouge!,"[18, 10749, 10402]","A celebration of love and creative inspiration takes place in the infamous, gaudy and glamorous Parisian nightclub, at the cusp of the 20th century. A young poet, who is plunged into the heady world of Moulin Rouge, begins a passionate affair with the club's most notorious and beautiful star."
1579,Apocalypto,"[28, 18, 53, 36]","Set in the Mayan civilization, when a man's idyllic presence is brutally disrupted by a violent invading force, he is taken on a perilous journey to a world ruled by fear and oppression where a harrowing end awaits him. Through a twist of fate and spurred by the power of his love for his woman and his family he will make a desperate break to return home and to ultimately save his way of life."
39513,Paul,"[12, 35, 878]","For the past 60 years, a space-traveling smart-ass named Paul has been locked up in a top-secret military base, advising world leaders about his kind. But when he worries he’s outlived his usefulness and the dissection table is drawing uncomfortably close, Paul escapes on the first RV that passes by his compound in Area 51. Fortunately, it contains the two earthlings who are most likely to rescue and harbor an alien on the run."
8321,In Bruges,"[35, 18, 80]","Ray and Ken, two hit men, are in Bruges, Belgium, waiting for their next mission. While they are there they have time to think and discuss their previous assignment. When the mission is revealed to Ken, it is not what he expected."
107,Snatch,"[80, 35]","Unscrupulous boxing promoters, violent bookmakers, a Russian gangster, incompetent amateur robbers and supposedly Jewish jewelers fight to track down a priceless stolen diamond."
4722,Body Snatchers,"[27, 878, 53]","When Environmental Protection Agency inspector Steve Malone travels to a remote military base in order to check for toxic materials, he brings his family along for the ride. After arriving at the base, his teenage daughter Marti befriends Jean Platt, daughter of the base's commander, General Platt. When people at the base begin acting strangely, Marti becomes convinced that they are slowly being replaced by plant-like aliens."
100,"Lock, Stock and Two Smoking Barrels","[35, 80]",A card shark and his unwillingly-enlisted friends need to make a lot of cash quick after losing a sketchy poker match. To do this they decide to pull a heist on a small-time gang who happen to be operating out of the flat next door.
694,The Shining,"[27, 53]","Jack Torrance accepts a caretaker job at the Overlook Hotel, where he, along with his wife Wendy and their son Danny, must live isolated from the rest of the world for the winter. But they aren't prepared for the madness that lurks within."
34584,Die unendliche Geschichte,"[18, 10751, 14, 12]","While hiding from bullies in his school's attic, a young boy discovers the extraordinary land of Fantasia, through a magical book called The Neverending Story. The book tells the tale of Atreyu, a young warrior who, with the help of a luck dragon named Falkor, must save Fantasia from the destruction of The Nothing."
34636,The NeverEnding Story II: The Next Chapter,"[18, 10751, 14, 12]","Once again, Bastian is transported to the world of Fantasia which he recently managed to save from destruction. However, the land is now being destroyed by an evil sorceress, Xayide, so he must join up with Atreyu and face the Emptiness once more."
27793,The NeverEnding Story III,"[14, 10751]",A young boy must restore order when a group of bullies steal the magical book that acts as a portal between Earth and the imaginary world of Fantasia.
11418,National Lampoon's European Vacation,"[12, 35, 10749]","The Griswalds win a vacation to Europe on a game show, and so pack their bags for the continent. They do their best to catch the flavor of Europe, but they just don't know how to be be good tourists. Besides, they have trouble taking holidays in countries where they CAN speak the language."
2105,American Pie,"[35, 10749]","At a high-school party, four friends find that losing their collective virginity isn't as easy as they had thought. But they still believe that they need to do so before college. To motivate themselves, they enter a pact to all ""score"" by their senior prom."
2770,American Pie 2,"[35, 10749]","After a year apart - attending different schools, meeting different people - the guys rent a beach house and vow to make this the best summer ever. As it turns out, whether that will happen or not has a lot to do with the girls. Between the wild parties, outrageous revelations and yes, a trip to band camp, they discover that times change and people change, but in the end, it's all about sticking together."
71552,American Reunion,[35],"The characters we met a little more than a decade ago return to East Great Falls for their high-school reunion. In one long-overdue weekend, they will discover what has changed, who hasn’t, and that time and distance can’t break the bonds of friendship."
773,Little Miss Sunshine,"[35, 18]","A family loaded with quirky, colorful characters piles into an old van and road trips to California for little Olive to compete in a beauty pageant."
